{
  "schema_version": "1.0",
  "request_id": "approval_01",
  "task_id": "task_demo",
  "run_id": "run_demo_02",
  "revision": 1,
  "call_id": "call_mail_01",
  "tool_name": "mail.send",
  "payload_digest": "cccccccccccccccccccccccccccccccccccccccccccccccccccccccccccccccc",
  "resource_refs": [
    "draft:demo_01"
  ],
  "effect_preview": "Enviar el borrador demo_01 a la dirección de prueba aprobada. No es un envío real.",
  "expires_at": "2026-09-10T07:00:00Z",
  "state": "pending",
  "decision_scope": "once"
}